root@CsDroplet:~# tcpdump -n -i eth0
20:57:54.326853 IP 198.96.85.21.60422 > 159.203.8.166.22: Flags [.], ack 2432968, win 511, length 0
20:57:54.326879 IP 198.96.85.21.60422 > 159.203.8.166.22: Flags [.], ack 2433384, win 510, length 0
20:57:54.327100 IP 159.203.8.166.22 > 198.96.85.21.60422: Flags [P.], seq 2437952:2438316, ack 1297, win 457, length 364
20:57:54.327288 IP 159.203.8.166.22 > 198.96.85.21.60422: Flags [P.], seq 2438316:2438472, ack 1297, win 457, length 156
20:57:54.327601 IP 159.203.8.166.22 > 198.96.85.21.60422: Flags [P.], seq 2438472:2438628, ack 1297, win 457, length 156
20:57:54.327769 IP 159.203.8.166.22 > 198.96.85.21.60422: Flags [P.], seq 2438628:2438784, ack 1297, win 457, length 156
20:57:54.327936 IP 159.203.8.166.22 > 198.96.85.21.60422: Flags [P.], seq 2438784:2438940, ack 1297, win 457, length 156
20:57:54.328096 IP 159.203.8.166.22 > 198.96.85.21.60422: Flags [P.], seq 2438940:2439096, ack 1297, win 457, length 156
20:57:54.328263 IP 159.203.8.166.22 > 198.96.85.21.60422: Flags [P.], seq 2439096:2439252, ack 1297, win 457, length 156
20:57:54.328462 IP 159.203.8.166.22 > 198.96.85.21.60422: Flags [P.], seq 2439252:2439408, ack 1297, win 457, length 156
20:57:54.328616 IP 159.203.8.166.22 > 198.96.85.21.60422: Flags [P.], seq 2439408:2439564, ack 1297, win 457, length 156
20:57:54.328786 IP 159.203.8.166.22 > 198.96.85.21.60422: Flags [P.], seq 2439564:2439720, ack 1297, win 457, length 156
20:57:54.328858 IP 198.96.85.21.60422 > 159.203.8.166.22: Flags [.], ack 2433696, win 508, length 0
20:57:54.328885 IP 198.96.85.21.60422 > 159.203.8.166.22: Flags [.], ack 2434008, win 512, length 0
20:57:54.328896 IP 198.96.85.21.60422 > 159.203.8.166.22: Flags [.], ack 2434320, win 511, length 0
20:57:54.328906 IP 198.96.85.21.60422 > 159.203.8.166.22: Flags [.], ack 2434632, win 510, length 0
20:57:54.328916 IP 198.96.85.21.60422 > 159.203.8.166.22: Flags [.], ack 2434944, win 509, length 0
20:57:54.328993 IP 198.96.85.21.60422 > 159.203.8.166.22: Flags [.], ack 2435256, win 508, length 0
20:57:54.329319 IP 159.203.8.166.22 > 198.96.85.21.60422: Flags [P.], seq 2439720:2440484, ack 1297, win 457, length 764
20:57:54.329510 IP 159.203.8.166.22 > 198.96.85.21.60422: Flags [P.], seq 2440484:2440640, ack 1297, win 457, length 156
20:57:54.329692 IP 159.203.8.166.22 > 198.96.85.21.60422: Flags [P.], seq 2440640:2440796, ack 1297, win 457, length 156
20:57:54.329767 IP 198.96.85.21.60422 > 159.203.8.166.22: Flags [P.], seq 1297:1333, ack 2435828, win 511, length 36
20:57:54.329797 IP 198.96.85.21.60422 > 159.203.8.166.22: Flags [.], ack 2436548, win 509, length 0
20:57:54.329875 IP 198.96.85.21.60422 > 159.203.8.166.22: Flags [.], ack 2436860, win 507, length 0
^C
17655 packets captured
17910 packets received by filter
250 packets dropped by kernel
root@CsDroplet:~#
